day,dish_name,ingredients,ingredient_quantity,ingredient_unit,ingredient_cost,preparation_steps
Monday,Spaghetti Bolognese,"['Spaghetti', 'Ground beef', 'Tomato sauce', 'Onion', 'Garlic', 'Olive oil', 'Salt', 'Pepper']","[200, 300, 400, 1, 2, 20, 5, 2]","['grams', 'grams', 'ml', 'unit', 'cloves', 'ml', 'grams', 'grams']","[0.5, 3.5, 1, 0.3, 0.2, 0.3, 0.1, 0.1]","['Cook spaghetti according to package instructions.', 'In a pan, heat olive oil and sauté onion and garlic.', 'Add ground beef and cook until browned.', 'Stir in tomato sauce, salt, and pepper.', 'Simmer for 20 minutes.', 'Serve Bolognese sauce over cooked spaghetti.']"
Tuesday,Chicken Stir-fry,"['Chicken breast', 'Bell peppers', 'Broccoli', 'Soy sauce', 'Ginger', 'Garlic', 'Vegetable oil', 'Rice']","[300, 2, 1, 30, 1, 2, 20, 150]","['grams', 'units', 'unit', 'ml', 'tsp', 'cloves', 'ml', 'grams']","[2.5, 1, 1, 0.5, 0.1, 0.2, 0.1, 0.3]","['Marinate chicken in soy sauce, ginger, and garlic.', 'Stir-fry chicken until cooked.', 'Add bell peppers and broccoli.', 'Stir in soy sauce.', 'Serve over cooked rice.']"
Wednesday,Vegetarian Quinoa Salad,"['Quinoa', 'Cucumber', 'Cherry tomatoes', 'Red onion', 'Feta cheese', 'Lemon juice', 'Olive oil', 'Salt', 'Pepper']","[150, 1, 100, 1, 50, 1, 10, 2, 1]","['grams', 'unit', 'grams', 'unit', 'grams', 'tbsp', 'ml', 'tsp', 'tsp']","[1, 0.5, 0.7, 0.2, 1, 0.3, 0.2, 0.1, 0.1]","['Cook quinoa according to package instructions.', 'Chop cucumber, cherry tomatoes, and red onion.', 'Mix quinoa with vegetables and feta cheese.', 'Drizzle with lemon juice and olive oil.', 'Season with salt and pepper.']"
Thursday,Beef Tacos,"['Beef strips', 'Taco shells', 'Lettuce', 'Tomato', 'Cheddar cheese', 'Sour cream', 'Avocado', 'Onion', 'Cilantro']","[300, 6, 1, 1, 50, 30, 1, 1, 10]","['grams', 'units', 'unit', 'unit', 'grams', 'ml', 'unit', 'unit', 'grams']","[3.5, 1, 0.3, 0.2, 0.5, 0.4, 1, 0.3, 0.2]","['Season beef strips with spices and sear in a hot pan.', 'Warm taco shells in the oven.', 'Assemble tacos with beef, lettuce, tomato, cheese, sour cream, avocado, onion, and cilantro.']"
Friday,Salmon with Roasted Vegetables,"['Salmon fillet', 'Zucchini', 'Bell peppers', 'Cherry tomatoes', 'Red onion', 'Olive oil', 'Garlic', 'Salt', 'Pepper']","[200, 1, 2, 100, 1, 20, 2, 2, 1]","['grams', 'unit', 'units', 'grams', 'unit', 'ml', 'cloves', 'tsp', 'tsp']","[4, 0.5, 0.8, 0.5, 0.2, 0.3, 0.2, 0.1, 0.1]","['Season salmon with olive oil, garlic, salt, and pepper.', 'Roast in the oven with vegetables for 20 minutes.', 'Serve hot.']"
Saturday,Pasta Primavera,"['Pasta', 'Broccoli', 'Carrots', 'Zucchini', 'Cherry tomatoes', 'Garlic', 'Olive oil', 'Basil', 'Parmesan cheese']","[200, 1, 2, 1, 100, 2, 20, 5, 50]","['grams', 'unit', 'units', 'unit', 'grams', 'cloves', 'ml', 'grams', 'grams']","[0.5, 0.4, 0.3, 0.3, 0.7, 0.2, 0.3, 0.2, 0.8]","['Cook pasta according to package instructions.', 'Blanch broccoli, carrots, and zucchini.', 'Sauté garlic in olive oil.', 'Add blanched vegetables and cherry tomatoes.', 'Toss with pasta, basil, and Parmesan cheese.']"
Sunday,BBQ Chicken with Coleslaw,"['Chicken legs', 'BBQ sauce', 'Cabbage', 'Carrots', 'Mayonnaise', 'Apple cider vinegar', 'Sugar', 'Salt', 'Pepper']","[500, 50, 0.5, 1, 50, 30, 10, 2, 1]","['grams', 'ml', 'unit', 'unit', 'grams', 'ml', 'grams', 'tsp', 'tsp']","[3.5, 0.5, 0.5, 0.2, 0.3, 0.3, 0.1, 0.1, 0.1]","['Marinate chicken legs in BBQ sauce.', 'Grill until cooked through.', 'Shred cabbage and carrots for coleslaw.', 'Mix mayonnaise, apple cider vinegar, sugar, salt, and pepper for dressing.', 'Toss coleslaw vegetables in dressing.']"
